{
  "meta": {
    "title": "Gamescom 2026 – Dein Zwei-Tage-Guide",
    "shortTitle": "GC26 Guide",
    "version": "3.1.1",
    "dataVersion": "2026-08-23.5",
    "sourceReviewDate": "2026-08-23",
    "venue": "Koelnmesse, Köln",
    "coordinates": {
      "lat": 50.9469,
      "lon": 6.9833
    },
    "stay": {
      "start": "2026-08-27T10:00:00+02:00",
      "end": "2026-08-28T20:00:00+02:00",
      "days": [
        {
          "date": "2026-08-27",
          "label": "Donnerstag",
          "short": "Do",
          "hours": "10:00–20:00"
        },
        {
          "date": "2026-08-28",
          "label": "Freitag",
          "short": "Fr",
          "hours": "10:00–20:00"
        }
      ]
    },
    "officialUrls": {
      "exhibitors": "https://exhibitors.gamescom.global/en/gamescom-exhibitors/list-of-exhibitors/",
      "hallPlan": "https://exhibitors.gamescom.global/en/gamescom-exhibitors/hall-plan/",
      "congress": "https://congress.gamescom.global/de/programm/"
    },
    "sourcePolicy": "Offizielle Gamescom-Links führen ausschließlich in das aktuelle 2026-Ausstellerportal, den aktuellen Hallenplan oder das Congress-Programm. Frühere Besucher-Deep-Links wurden entfernt. Bei dynamischen Ausstellerprofilen zeigt die App zusätzlich den exakten Suchbegriff an.",
    "positionDisclaimer": "Indoor-GPS kann in Stahlhallen um viele Meter abweichen. Die Standortanzeige ist nur grob; die manuelle Hallenauswahl ist auf dem Gelände meist verlässlicher.",
    "lastUpdatedLabel": "Quellenstand 23. August 2026"
  },
  "categories": [
    {
      "id": "nintendo",
      "label": "Nintendo & Switch 2",
      "shortLabel": "Nintendo",
      "description": "Nintendo, Switch 2 und Drittanbieter-Titel, die auf Nintendos neuer Hardware spielbar sind.",
      "color": "#e60012",
      "icon": "N"
    },
    {
      "id": "retro",
      "label": "Retro & Arcade",
      "shortLabel": "Retro",
      "description": "Klassische Konsolen, Heimcomputer, Arcade, Sammler:innen und spielbare Nostalgie.",
      "color": "#f97316",
      "icon": "R"
    },
    {
      "id": "indie",
      "label": "Indie",
      "shortLabel": "Indie",
      "description": "Unabhängige Studios und kuratierte Gemeinschaftsstände wie die Indie Arena Booth.",
      "color": "#7c3aed",
      "icon": "I"
    },
    {
      "id": "goodies",
      "label": "Goodies & Freebies",
      "shortLabel": "Goodies",
      "description": "Belegte oder realistische Gratisaktionen. „Solange der Vorrat reicht“ bedeutet: früh hingehen.",
      "color": "#16a34a",
      "icon": "G"
    },
    {
      "id": "community",
      "label": "Community & Fanclub",
      "shortLabel": "Community",
      "description": "Fanclubs, Cosplay, Treffen, Community-Flächen und gemeinschaftliche Aktionen.",
      "color": "#db2777",
      "icon": "C"
    },
    {
      "id": "signing",
      "label": "Signing & Meet-up",
      "shortLabel": "Meet-up",
      "description": "Signings, besondere Gäste oder Community-Interaktionen – nur wenn konkret bestätigt.",
      "color": "#0891b2",
      "icon": "M"
    },
    {
      "id": "big-player",
      "label": "Große Player",
      "shortLabel": "Big Player",
      "description": "Große Publisher, Plattformen und besonders publikumsstarke Messeauftritte.",
      "color": "#2563eb",
      "icon": "B"
    },
    {
      "id": "talk",
      "label": "Talks & Shows",
      "shortLabel": "Talks",
      "description": "Feste Bühnen-, Stream- und Congress-Termine während deines Aufenthalts.",
      "color": "#9333ea",
      "icon": "T"
    },
    {
      "id": "hardware",
      "label": "Hardware & Setup",
      "shortLabel": "Hardware",
      "description": "Monitore, Gaming-Technik, Barrierefreiheit und besondere Setup-Erlebnisse.",
      "color": "#0f766e",
      "icon": "H"
    },
    {
      "id": "reality",
      "label": "Reality-Checks",
      "shortLabel": "Reality",
      "description": "Hype-Themen, bei denen die App klar trennt: vor Ort bestätigt, nur online oder noch unklar.",
      "color": "#475569",
      "icon": "?"
    }
  ],
  "halls": [
    {
      "id": "1",
      "label": "Halle 1",
      "shortLabel": "H1",
      "area": "Business/Partner",
      "description": "Keine Kernroute für den Publikumstag.",
      "x": 7,
      "y": 8,
      "w": 13,
      "h": 10,
      "accent": "#cbd5e1"
    },
    {
      "id": "2",
      "label": "Halle 2",
      "shortLabel": "H2",
      "area": "Business Area",
      "description": "Vorwiegend Fachpublikum und B2B.",
      "x": 22,
      "y": 8,
      "w": 13,
      "h": 10,
      "accent": "#cbd5e1"
    },
    {
      "id": "3",
      "label": "Halle 3",
      "shortLabel": "H3",
      "area": "Business Area",
      "description": "Vorwiegend Fachpublikum und B2B.",
      "x": 37,
      "y": 8,
      "w": 13,
      "h": 10,
      "accent": "#cbd5e1"
    },
    {
      "id": "4",
      "label": "Halle 4",
      "shortLabel": "H4",
      "area": "Business Area",
      "description": "Vorwiegend Fachpublikum und B2B.",
      "x": 52,
      "y": 8,
      "w": 13,
      "h": 10,
      "accent": "#cbd5e1"
    },
    {
      "id": "confex",
      "label": "Confex",
      "shortLabel": "Confex",
      "area": "Congress & Conference",
      "description": "Congress-Stages und Konferenzräume.",
      "x": 72,
      "y": 6,
      "w": 20,
      "h": 12,
      "accent": "#9333ea"
    },
    {
      "id": "5",
      "label": "Halle 5",
      "shortLabel": "H5",
      "area": "Merch, Cosplay & Community",
      "description": "Merchandise, Cosplay, Communities und gute Foto-Stopps.",
      "x": 8,
      "y": 27,
      "w": 18,
      "h": 15,
      "accent": "#db2777"
    },
    {
      "id": "6",
      "label": "Halle 6",
      "shortLabel": "H6",
      "area": "Publisher & Action",
      "description": "Ubisoft, Bandai Namco, Level Infinite, HoYoverse und GIANTS.",
      "x": 29,
      "y": 27,
      "w": 18,
      "h": 15,
      "accent": "#2563eb"
    },
    {
      "id": "7",
      "label": "Halle 7",
      "shortLabel": "H7",
      "area": "Xbox, NetEase & SEGA",
      "description": "Eine der wichtigsten Mainstream-Hallen – früh einplanen.",
      "x": 50,
      "y": 27,
      "w": 18,
      "h": 15,
      "accent": "#22c55e"
    },
    {
      "id": "8",
      "label": "Halle 8",
      "shortLabel": "H8",
      "area": "Gaming & Hardware",
      "description": "Weitere Gaming-, Hardware- und Aktionsflächen.",
      "x": 71,
      "y": 27,
      "w": 18,
      "h": 15,
      "accent": "#06b6d4"
    },
    {
      "id": "9",
      "label": "Halle 9",
      "shortLabel": "H9",
      "area": "Nintendo, Capcom & Samsung",
      "description": "Nintendo-/Switch-2-Schwerpunkt plus große Publikumsmagneten.",
      "x": 20,
      "y": 49,
      "w": 21,
      "h": 15,
      "accent": "#e60012"
    },
    {
      "id": "10",
      "label": "Halle 10",
      "shortLabel": "H10",
      "area": "Indie, Retro & Education",
      "description": "Indie Arena, Coffee Stain, Retro, Communities und ungewöhnliche Entdeckungen.",
      "x": 45,
      "y": 49,
      "w": 25,
      "h": 15,
      "accent": "#7c3aed"
    },
    {
      "id": "outdoor",
      "label": "Außenbereich",
      "shortLabel": "Outdoor",
      "area": "Freiflächen",
      "description": "Außenaktionen und Wege zwischen den Hallen.",
      "x": 74,
      "y": 50,
      "w": 16,
      "h": 13,
      "accent": "#64748b"
    }
  ],
  "routes": [
    {
      "id": "blockbuster",
      "name": "Blockbuster kompakt",
      "duration": "ca. 4–6 Std. plus Schlangen",
      "color": "#2563eb",
      "halls": [
        "6",
        "7",
        "9"
      ],
      "entryIds": [
        "bandai-namco",
        "level-infinite",
        "xbox",
        "netease",
        "nintendo",
        "capcom"
      ],
      "tip": "Donnerstag: 7 → 9 → 6. Freitag: offene Lücken und NetEase-Special."
    },
    {
      "id": "switch",
      "name": "Nintendo & Switch 2",
      "duration": "ca. 3–5 Std.",
      "color": "#e60012",
      "halls": [
        "9",
        "6"
      ],
      "entryIds": [
        "nintendo",
        "capcom",
        "big-n-club-watch",
        "bandai-namco"
      ],
      "tip": "Nintendo zuerst; Drittanbieter danach nach Wartezeit auswählen."
    },
    {
      "id": "discover",
      "name": "Indie, Retro & Community",
      "duration": "ca. 3–4 Std.",
      "color": "#7c3aed",
      "halls": [
        "10",
        "5"
      ],
      "entryIds": [
        "indie-arena",
        "coffee-stain",
        "scs-software",
        "commodore-retro",
        "hall5-community"
      ],
      "tip": "Halle 10 zum Spielen, Halle 5 zum Stöbern und Fotografieren."
    }
  ],
  "entries": [
    {
      "id": "xbox",
      "name": "Xbox: 25 Spiele, 140 Stationen",
      "typ": "exhibitor",
      "kategorien": [
        "big-player",
        "hardware"
      ],
      "halle": "7.1",
      "stand": "A061–C060",
      "kartenposition": {
        "x": 58,
        "y": 34
      },
      "beschreibung": "Der große Xbox-Publikumsstand bündelt Blockbuster, Hands-ons, Live-Demos und einen Jubiläumsbereich.",
      "warumInteressant": "Hier liegen mit Gears of War: E-Day, Call of Duty: Modern Warfare 4, Fable, Forza Horizon 6, Halo: Campaign Evolved und Minecraft Dungeons II besonders viele Mainstream-Titel dicht beieinander.",
      "bildUrl": "./assets/illustrations/xbox.svg",
      "gamescomLink": "https://exhibitors.gamescom.global/en/gamescom-exhibitors/list-of-exhibitors/",
      "gamescomLinkLabel": "Offizielles Gamescom-Ausstellerverzeichnis",
      "officialSearchTerm": "Microsoft Xbox",
      "externeLinks": [
        {
          "label": "Xbox Wire: offizieller Gamescom-Überblick",
          "url": "https://news.xbox.com/en-us/2026/07/28/xbox-gamescom-2026/",
          "type": "official"
        }
      ],
      "tage": [
        "2026-08-27",
        "2026-08-28"
      ],
      "goodie": false,
      "goodieText": "",
      "highlight": true,